{
    "$schema": "https://images.onerom.org/configs/schema.json",
    "version": 1,
    "name": "1541 Multi-ROM Sets",
    "description": "Stock ROMs sets for 1540/1541 drives which use 8KB (2364) ROMs",
    "categories": [
        "drive",
        "firmware",
        "commodore",
        "iec"
    ],
    "rom_sets": [
        {
            "type": "multi",
            "description": "1541 ROM set with 901229-06AA",
            "roms": [
                {
                    "description": "1541/1540 $C000 8KB ROM, 325302-01",
                    "file": "http://www.zimmers.net/anonftp/pub/cbm/firmware/drives/new/1541/1541-c000.325302-01.bin",
                    "type": "2364",
                    "cs1": "active_low"
                },
                {
                    "description": "1541 $E000 8KB ROM, 901229-06AA",
                    "file": "http://www.zimmers.net/anonftp/pub/cbm/firmware/drives/new/1541/1541-e000.901229-06AA.bin",
                    "type": "2364",
                    "cs1": "active_low"
                }
            ]
        },
        {
            "type": "multi",
            "description": "1541 ROM set with 901229-05",
            "roms": [
                {
                    "description": "1541/1540 $C000 8KB ROM, 325302-01",
                    "file": "http://www.zimmers.net/anonftp/pub/cbm/firmware/drives/new/1541/1541-c000.325302-01.bin",
                    "type": "2364",
                    "cs1": "active_low"
                },
                {
                    "description": "1541 $E000 8KB ROM, 901229-05",
                    "file": "http://www.zimmers.net/anonftp/pub/cbm/firmware/drives/new/1541/1541-e000.901229-05.bin",
                    "type": "2364",
                    "cs1": "active_low"
                }
            ]
        },
        {
            "type": "multi",
            "description": "1540 ROM set with 325303-01",
            "roms": [
                {
                    "description": "1541/1540 $C000 8KB ROM, 325302-01",
                    "file": "http://www.zimmers.net/anonftp/pub/cbm/firmware/drives/new/1541/1541-c000.325302-01.bin",
                    "type": "2364",
                    "cs1": "active_low"
                },
                {
                    "description": "1540 $E000 8KB ROM, 325303-01",
                    "file": "http://www.zimmers.net/anonftp/pub/cbm/firmware/drives/new/1541/1540-e000.325303-01.bin",
                    "type": "2364",
                    "cs1": "active_low"
                }
            ]
        }
    ],
    "notes": "The _lower_ ROM ($C000) is the first image in the set. This means you must install SDRR in the $C000 ROM slot (UB3), and connect X1 to pin 20 of the $E000 ROM slot (UB4)."
}