{
    "$schema": "https://images.onerom.org/configs/schema.json",
    "version": 1,
    "name": "1541-II",
    "description": "Stock 28-pin ROM images for a 1541-II",
    "categories": [
        "drive",
        "firmware",
        "commodore",
        "iec"
    ],
    "rom_sets": [
        {
            "type": "single",
            "roms": [
                {
                    "description": "16KB firmware, 251968-03",
                    "file": "http://www.zimmers.net/anonftp/pub/cbm/firmware/drives/new/1541/1541-II.251968-03.bin",
                    "type": "27128"
                }
            ]
        }
    ],
    "notes": "To do: Add other ROMs"
}