{
    "$schema": "https://images.onerom.org/configs/schema.json",
    "version": 1,
    "name": "4040",
    "description": "Stock ROMs for DOS2 4040 (and 2040/3040) IEEE disk drives",
    "categories": [
        "drive",
        "firmware",
        "commodore",
        "ieee"
    ],
    "rom_sets": [
        {
            "type": "single",
            "roms": [
                {
                    "description": "$F000 4KB ROM, 901468-16",
                    "file": "http://www.zimmers.net/anonftp/pub/cbm/firmware/drives/old/4040/901468-16.bin",
                    "type": "2332",
                    "cs1": "active_low",
                    "cs2": "active_high"
                }
            ]
        },
        {
            "type": "single",
            "roms": [
                {
                    "description": "$E000 4KB ROM, 901468-15",
                    "file": "http://www.zimmers.net/anonftp/pub/cbm/firmware/drives/old/4040/901468-15.bin",
                    "type": "2332",
                    "cs1": "active_low",
                    "cs2": "active_high"
                }
            ]
        },
        {
            "type": "single",
            "roms": [
                {
                    "description": "$D000 4KB ROM, 901468-14",
                    "file": "http://www.zimmers.net/anonftp/pub/cbm/firmware/drives/old/4040/901468-14.bin",
                    "type": "2332",
                    "cs1": "active_low",
                    "cs2": "active_high"
                }
            ]
        },
        {
            "type": "single",
            "roms": [
                {
                    "description": "$F000 4KB ROM, 901468-13",
                    "file": "http://www.zimmers.net/anonftp/pub/cbm/firmware/drives/old/4040/901468-13.bin",
                    "type": "2332",
                    "cs1": "active_low",
                    "cs2": "active_high"
                }
            ]
        },
        {
            "type": "single",
            "roms": [
                {
                    "description": "$E000 4KB ROM, 901468-12",
                    "file": "http://www.zimmers.net/anonftp/pub/cbm/firmware/drives/old/4040/901468-12.bin",
                    "type": "2332",
                    "cs1": "active_low",
                    "cs2": "active_high"
                }
            ]
        },
        {
            "type": "single",
            "roms": [
                {
                    "description": "$D000 4KB ROM, 901468-11",
                    "file": "http://www.zimmers.net/anonftp/pub/cbm/firmware/drives/old/4040/901468-11.bin",
                    "type": "2332",
                    "cs1": "active_low",
                    "cs2": "active_high"
                }
            ]
        }
    ]
}