{
    "$schema": "https://images.onerom.org/configs/schema.json",
    "version": 1,
    "name": "C64C",
    "description": "Stock 28-pin ROM images for a C64C",
    "categories": [
        "computer",
        "firmware",
        "commodore",
        "c64"
    ],
    "rom_sets": [
        {
            "type": "single",
            "roms": [
                {
                    "description": "16KB BASIC+Kernal ROM, 251913-01",
                    "file": "http://www.zimmers.net/anonftp/pub/cbm/firmware/computers/c64/64c.251913-01.bin",
                    "type": "23128",
                    "cs1": "active_low",
                    "cs2": "active_low",
                    "cs3": "active_high"
                }
            ]
        }
    ]
}