{
    "$schema": "https://images.onerom.org/configs/schema.json",
    "version": 1,
    "name": "CoCo 2",
    "description": "Stock ROMs for a Tandy Color Computer 2",
    "categories": [
        "computer",
        "firmware",
        "tandy",
        "coco"
    ],
    "rom_sets": [
        {
            "type": "single",
            "roms": [
                {
                    "description": "8KB Color Basic 1.3",
                    "file": "https://archive.org/download/mame-0.221-roms-merged/coco.zip",
                    "extract": "coco2b/bas13.rom",
                    "type": "2364",
                    "cs1": "active_low"
                }
            ]
        },
        {
            "type": "single",
            "roms": [
                {
                    "description": "8KB Extended Color Basic 1.1",
                    "file": "https://archive.org/download/mame-0.221-roms-merged/coco.zip",
                    "extract": "coco2/extbas11.rom",
                    "type": "2364",
                    "cs1": "active_low"
                }
            ]
        },
        {
            "type": "single",
            "roms": [
                {
                    "description": "8KB Color Basic 1.2",
                    "file": "https://archive.org/download/mame-0.221-roms-merged/coco.zip",
                    "extract": "coco2/bas12.rom",
                    "type": "2364",
                    "cs1": "active_low"
                }
            ]
        }
    ]
}