{
    "$schema": "https://images.onerom.org/configs/schema.json",
    "version": 1,
    "name": "C64",
    "description": "Stock ROMs for a C64 including the DesTestMAX diagnostic ROM",
    "categories": [
        "computer",
        "firmware",
        "commodore",
        "diag",
        "c64"
    ],
    "rom_sets": [
        {
            "type": "single",
            "roms": [
                {
                    "description": "8KB Kernal ROM, 901227-03",
                    "file": "http://www.zimmers.net/anonftp/pub/cbm/firmware/computers/c64/kernal.901227-03.bin",
                    "type": "2364",
                    "cs1": "active_low"
                }
            ]
        },
        {
            "type": "single",
            "roms": [
                {
                    "description": "8KB Basic ROM, 901226-01",
                    "file": "http://www.zimmers.net/anonftp/pub/cbm/firmware/computers/c64/basic.901226-01.bin",
                    "type": "2364",
                    "cs1": "active_low"
                }
            ]
        },
        {
            "type": "single",
            "roms": [
                {
                    "description": "4KB Character ROM, 901225-01",
                    "file": "http://www.zimmers.net/anonftp/pub/cbm/firmware/computers/c64/characters.901225-01.bin",
                    "type": "2332",
                    "cs1": "active_low",
                    "cs2": "active_high"
                }
            ]
        },
        {
            "type": "single",
            "roms": [
                {
                    "description": "8KB Dead Test Kernal ($E000) ROM, 781220",
                    "file": "http://www.zimmers.net/anonftp/pub/cbm/firmware/misc/c64diag/c64_diag-rev781220-pn314139-03.zip",
                    "extract": "Diag_DeadTest/dead test.BIN",
                    "type": "2364",
                    "cs1": "active_low"
                }
            ]
        },
        {
            "type": "single",
            "roms": [
                {
                    "description": "8KB DesTestMAX Kernal ($E000) ROM - https://factorofmatt.com/destestmax",
                    "file": "https://img1.wsimg.com/blobby/go/66231677-2ba7-409f-8dee-bbd44bbf8f37/downloads/destest-max-v0.1.zip?ver=1750944987245",
                    "extract": "destest-max.rom",
                    "licence": "https://factorofmatt.com/destestmax%2Fdestestmax-sl",
                    "type": "2364",
                    "cs1": "active_low"
                }
            ]
        }
    ]
}