{
    "$schema": "https://images.onerom.org/configs/schema.json",
    "version": 1,
    "name": "TI-99/4A",
    "description": "Stock ROMs for a TI-99 4/a",
    "categories": [
        "computer",
        "firmware",
        "ti",
        "ti99"
    ],
    "rom_sets": [
        {
            "type": "single",
            "roms": [
                {
                    "description": "4KB HB System ROM",
                    "file": "https://archive.org/download/mame-0.221-roms-merged/ti99_4a.zip",
                    "extract": "994a_rom_hb.u610",
                    "type": "2332",
                    "cs1": "active_low",
                    "cs2": "active_low"
                }
            ]
        },
        {
            "type": "single",
            "roms": [
                {
                    "description": "4KB LB System ROM",
                    "file": "https://archive.org/download/mame-0.221-roms-merged/ti99_4a.zip",
                    "extract": "994a_rom_lb.u611",
                    "type": "2332",
                    "cs1": "active_low",
                    "cs2": "active_low"
                }
            ]
        }
    ]
}