{
    "$schema": "https://images.onerom.org/configs/schema.json",
    "version": 1,
    "name": "Pincoder version 2021 System 7 (18 ROMs)",
    "description": "Pincoder version 2021-03-31 for Williams System 7 (18 ROMs)",
    "categories" : [
        "motorola-6800",
        "arcade",
        "pinball"
    ],
    "notes": "For more details on these ROMs, see the Pincoder website: https://pincoder.ca/",
    "rom_sets": [
        {
            "type": "single",
            "roms": [
                {
                    "description": "01a-leds",
                    "file": "https://pincoder.ca/ccn/roms/pincoder_roms_2021.03.31.1434.zip",
                    "extract": "pincoder_roms_2021.03.31.1434/Williams/sys7/4K/01a-leds.bin",
                    "label": "01a-leds",
                    "type": "2332",
                    "cs1": "active_low",
                    "cs2": "active_high"
                }
            ]
        },
        {
            "type": "single",
            "roms": [
                {
                    "description": "01b-bus",
                    "file": "https://pincoder.ca/ccn/roms/pincoder_roms_2021.03.31.1434.zip",
                    "extract": "pincoder_roms_2021.03.31.1434/Williams/sys7/4K/01b-bus.bin",
                    "label": "01b-bus",
                    "type": "2332",
                    "cs1": "active_low",
                    "cs2": "active_high"
                }
            ]
        },
        {
            "type": "single",
            "roms": [
                {
                    "description": "01c-transceivers",
                    "file": "https://pincoder.ca/ccn/roms/pincoder_roms_2021.03.31.1434.zip",
                    "extract": "pincoder_roms_2021.03.31.1434/Williams/sys7/4K/01c-transceivers.bin",
                    "label": "01c-transceivers",
                    "type": "2332",
                    "cs1": "active_low",
                    "cs2": "active_high"
                }
            ]
        },
        {
            "type": "single",
            "roms": [
                {
                    "description": "02-blanking",
                    "file": "https://pincoder.ca/ccn/roms/pincoder_roms_2021.03.31.1434.zip",
                    "extract": "pincoder_roms_2021.03.31.1434/Williams/sys7/4K/02-blanking.bin",
                    "label": "02-blanking",
                    "type": "2332",
                    "cs1": "active_low",
                    "cs2": "active_high"
                }
            ]
        },
        {
            "type": "single",
            "roms": [
                {
                    "description": "03-cmos-IC19",
                    "file": "https://pincoder.ca/ccn/roms/pincoder_roms_2021.03.31.1434.zip",
                    "extract": "pincoder_roms_2021.03.31.1434/Williams/sys7/4K/03-cmos-IC19.bin",
                    "label": "03-cmos-IC19",
                    "type": "2332",
                    "cs1": "active_low",
                    "cs2": "active_high"
                }
            ]
        },
        {
            "type": "single",
            "roms": [
                {
                    "description": "04-ram-IC16",
                    "file": "https://pincoder.ca/ccn/roms/pincoder_roms_2021.03.31.1434.zip",
                    "extract": "pincoder_roms_2021.03.31.1434/Williams/sys7/4K/04-ram-IC16.bin",
                    "label": "04-ram-IC16",
                    "type": "2332",
                    "cs1": "active_low",
                    "cs2": "active_high"
                }
            ]
        },
        {
            "type": "single",
            "roms": [
                {
                    "description": "05-displays",
                    "file": "https://pincoder.ca/ccn/roms/pincoder_roms_2021.03.31.1434.zip",
                    "extract": "pincoder_roms_2021.03.31.1434/Williams/sys7/4K/05-displays.bin",
                    "label": "05-displays",
                    "type": "2332",
                    "cs1": "active_low",
                    "cs2": "active_high"
                }
            ]
        },
        {
            "type": "single",
            "roms": [
                {
                    "description": "06-switches",
                    "file": "https://pincoder.ca/ccn/roms/pincoder_roms_2021.03.31.1434.zip",
                    "extract": "pincoder_roms_2021.03.31.1434/Williams/sys7/4K/06-switches.bin",
                    "label": "06-switches",
                    "type": "2332",
                    "cs1": "active_low",
                    "cs2": "active_high"
                }
            ]
        },
        {
            "type": "single",
            "roms": [
                {
                    "description": "07-bounce",
                    "file": "https://pincoder.ca/ccn/roms/pincoder_roms_2021.03.31.1434.zip",
                    "extract": "pincoder_roms_2021.03.31.1434/Williams/sys7/4K/07-bounce.bin",
                    "label": "07-bounce",
                    "type": "2332",
                    "cs1": "active_low",
                    "cs2": "active_high"
                }
            ]
        },
        {
            "type": "single",
            "roms": [
                {
                    "description": "08-interrupts",
                    "file": "https://pincoder.ca/ccn/roms/pincoder_roms_2021.03.31.1434.zip",
                    "extract": "pincoder_roms_2021.03.31.1434/Williams/sys7/4K/08-interrupts.bin",
                    "label": "08-interrupts",
                    "type": "2332",
                    "cs1": "active_low",
                    "cs2": "active_high"
                }
            ]
        },
        {
            "type": "single",
            "roms": [
                {
                    "description": "09-lamps",
                    "file": "https://pincoder.ca/ccn/roms/pincoder_roms_2021.03.31.1434.zip",
                    "extract": "pincoder_roms_2021.03.31.1434/Williams/sys7/4K/09-lamps.bin",
                    "label": "09-lamps",
                    "type": "2332",
                    "cs1": "active_low",
                    "cs2": "active_high"
                }
            ]
        },
        {
            "type": "single",
            "roms": [
                {
                    "description": "10-solenoids",
                    "file": "https://pincoder.ca/ccn/roms/pincoder_roms_2021.03.31.1434.zip",
                    "extract": "pincoder_roms_2021.03.31.1434/Williams/sys7/4K/10-solenoids.bin",
                    "label": "10-solenoids",
                    "type": "2332",
                    "cs1": "active_low",
                    "cs2": "active_high"
                }
            ]
        },
                {
            "type": "single",
            "roms": [
                {
                    "description": "11a-sounds",
                    "file": "https://pincoder.ca/ccn/roms/pincoder_roms_2021.03.31.1434.zip",
                    "extract": "pincoder_roms_2021.03.31.1434/Williams/sys7/4K/11a-sounds.bin",
                    "label": "11a-sounds",
                    "type": "2332",
                    "cs1": "active_low",
                    "cs2": "active_high"
                }
            ]
        },
        {
            "type": "single",
            "roms": [
                {
                    "description": "11b-sounds",
                    "file": "https://pincoder.ca/ccn/roms/pincoder_roms_2021.03.31.1434.zip",
                    "extract": "pincoder_roms_2021.03.31.1434/Williams/sys7/4K/11b-sounds.bin",
                    "label": "11b-sounds",
                    "type": "2332",
                    "cs1": "active_low",
                    "cs2": "active_high"
                }
            ]
        },
        {
            "type": "single",
            "roms": [
                {
                    "description": "12-flippers",
                    "file": "https://pincoder.ca/ccn/roms/pincoder_roms_2021.03.31.1434.zip",
                    "extract": "pincoder_roms_2021.03.31.1434/Williams/sys7/4K/12-flippers.bin",
                    "label": "12-flippers",
                    "type": "2332",
                    "cs1": "active_low",
                    "cs2": "active_high"
                }
            ]
        },
        {
            "type": "single",
            "roms": [
                {
                    "description": "clear_cmos",
                    "file": "https://pincoder.ca/ccn/roms/pincoder_roms_2021.03.31.1434.zip",
                    "extract": "pincoder_roms_2021.03.31.1434/Williams/sys7/4K/clear_cmos.bin",
                    "label": "clear_cmos",
                    "type": "2332",
                    "cs1": "active_low",
                    "cs2": "active_high"
                }
            ]
        },
        {
            "type": "single",
            "roms": [
                {
                    "description": "edit_cmos",
                    "file": "https://pincoder.ca/ccn/roms/pincoder_roms_2021.03.31.1434.zip",
                    "extract": "pincoder_roms_2021.03.31.1434/Williams/sys7/4K/edit_cmos.bin",
                    "label": "edit_cmos",
                    "type": "2332",
                    "cs1": "active_low",
                    "cs2": "active_high"
                }
            ]
        },
        {
            "type": "single",
            "roms": [
                {
                    "description": "init_cmos",
                    "file": "https://pincoder.ca/ccn/roms/pincoder_roms_2021.03.31.1434.zip",
                    "extract": "pincoder_roms_2021.03.31.1434/Williams/sys7/4K/init_cmos.bin",
                    "label": "init_cmos",
                    "type": "2332",
                    "cs1": "active_low",
                    "cs2": "active_high"
                }
            ]
        }
    ]
}