{
    "$schema": "https://images.onerom.org/configs/schema.json",
    "version": 1,
    "name": "Pincoder 2021 System 7 Tests 10-12",
    "description": "Pincoder version 2021-03-31 for Williams System 7, Tests 10-12 and CMOS utils (6 ROMs)",
    "categories" : [
        "motorola-6800",
        "arcade",
        "pinball"
    ],
    "notes": "For more details on these ROMs, see the Pincoder website: https://pincoder.ca/",
    "rom_sets": [
        {
            "type": "single",
            "roms": [
                {
                    "description": "11a-sounds",
                    "file": "https://pincoder.ca/ccn/roms/pincoder_roms_2021.03.31.1434.zip",
                    "extract": "pincoder_roms_2021.03.31.1434/Williams/sys7/4K/11a-sounds.bin",
                    "label": "11a-sounds",
                    "type": "2332",
                    "cs1": "active_low",
                    "cs2": "active_high"
                }
            ]
        },
        {
            "type": "single",
            "roms": [
                {
                    "description": "11b-sounds",
                    "file": "https://pincoder.ca/ccn/roms/pincoder_roms_2021.03.31.1434.zip",
                    "extract": "pincoder_roms_2021.03.31.1434/Williams/sys7/4K/11b-sounds.bin",
                    "label": "11b-sounds",
                    "type": "2332",
                    "cs1": "active_low",
                    "cs2": "active_high"
                }
            ]
        },
        {
            "type": "single",
            "roms": [
                {
                    "description": "12-flippers",
                    "file": "https://pincoder.ca/ccn/roms/pincoder_roms_2021.03.31.1434.zip",
                    "extract": "pincoder_roms_2021.03.31.1434/Williams/sys7/4K/12-flippers.bin",
                    "label": "12-flippers",
                    "type": "2332",
                    "cs1": "active_low",
                    "cs2": "active_high"
                }
            ]
        },
        {
            "type": "single",
            "roms": [
                {
                    "description": "clear_cmos",
                    "file": "https://pincoder.ca/ccn/roms/pincoder_roms_2021.03.31.1434.zip",
                    "extract": "pincoder_roms_2021.03.31.1434/Williams/sys7/4K/clear_cmos.bin",
                    "label": "clear_cmos",
                    "type": "2332",
                    "cs1": "active_low",
                    "cs2": "active_high"
                }
            ]
        },
        {
            "type": "single",
            "roms": [
                {
                    "description": "edit_cmos",
                    "file": "https://pincoder.ca/ccn/roms/pincoder_roms_2021.03.31.1434.zip",
                    "extract": "pincoder_roms_2021.03.31.1434/Williams/sys7/4K/edit_cmos.bin",
                    "label": "edit_cmos",
                    "type": "2332",
                    "cs1": "active_low",
                    "cs2": "active_high"
                }
            ]
        },
        {
            "type": "single",
            "roms": [
                {
                    "description": "init_cmos",
                    "file": "https://pincoder.ca/ccn/roms/pincoder_roms_2021.03.31.1434.zip",
                    "extract": "pincoder_roms_2021.03.31.1434/Williams/sys7/4K/init_cmos.bin",
                    "label": "init_cmos",
                    "type": "2332",
                    "cs1": "active_low",
                    "cs2": "active_high"
                }
            ]
        }
    ]
}